{"type":"OpenSensorTemplate","template_version":"0.1.0","id":"waveshare-sim7670g-telemetry-v6","title":"Waveshare ESP32-S3-SIM7670G-4G V2.0 with Plantower PMS5003T and Analog Devices MAX17048","keywords":["air quality","particulate matter","PM2.5","air temperature","relative humidity","low-cost sensor"],"instruments":["pms5003t","max17048","esp_runtime"],"opensensor:sample_interval_s":10,"item_assets":{"data":{"type":"application/vnd.apache.parquet","roles":["data"],"table:primary_datetime":"event_time_utc_us","table:primary_geometry":"geometry","table:columns":[{"name":"schema_version","type":"int32","unit":"1","roles":["referenceInformation"],"opensensor:property":"urn:walkthru-earth:property:schema_version","opensensor:procedure":"logger","opensensor:field_id":1,"opensensor:aggregate":"mode"},{"name":"device_id","type":"int64","unit":"1","roles":["referenceInformation"],"opensensor:property":"urn:walkthru-earth:property:device_identifier","opensensor:procedure":"identity","opensensor:field_id":2,"opensensor:aggregate":"mode"},{"name":"boot_id_hi","type":"int64","unit":"1","roles":["referenceInformation"],"opensensor:property":"urn:walkthru-earth:property:boot_identifier_high","opensensor:procedure":"identity","opensensor:field_id":3,"opensensor:aggregate":"mode"},{"name":"boot_id_lo","type":"int64","unit":"1","roles":["referenceInformation"],"opensensor:property":"urn:walkthru-earth:property:boot_identifier_low","opensensor:procedure":"identity","opensensor:field_id":4,"opensensor:aggregate":"mode"},{"name":"sequence","type":"int64","unit":"{count}","roles":["referenceInformation"],"opensensor:property":"urn:walkthru-earth:property:sample_sequence_number","opensensor:procedure":"logger","opensensor:field_id":5,"opensensor:aggregate":"point"},{"name":"monotonic_us","type":"int64","unit":"us","roles":["referenceInformation"],"opensensor:property":"urn:walkthru-earth:property:monotonic_time_since_boot","opensensor:procedure":"clock","opensensor:field_id":6,"opensensor:aggregate":"point"},{"name":"scheduled_us","type":"int64","unit":"us","roles":["referenceInformation"],"opensensor:property":"urn:walkthru-earth:property:scheduled_sample_time_since_boot","opensensor:procedure":"clock","opensensor:field_id":7,"opensensor:aggregate":"point"},{"name":"sample_jitter_us","type":"int64","unit":"us","roles":["auxiliaryInformation"],"opensensor:property":"urn:walkthru-earth:property:sample_jitter","opensensor:procedure":"clock","opensensor:field_id":8,"opensensor:aggregate":"mean"},{"name":"event_time_utc_us","type":"int64","unit":"us","roles":["coordinate"],"cf:standard_name":"time","opensensor:property":"http://vocab.nerc.ac.uk/collection/P07/current/CFSN0115/","opensensor:procedure":"clock","opensensor:field_id":9,"opensensor:aggregate":"point"},{"name":"clock_status","type":"int32","unit":"{code}","roles":["qualityInformation"],"classification:classes":[{"value":0,"name":"none"},{"value":1,"name":"host"},{"value":3,"name":"network"}],"opensensor:property":"urn:walkthru-earth:property:clock_status","opensensor:procedure":"clock","opensensor:field_id":10,"opensensor:aggregate":"mode"},{"name":"pms_status","type":"int32","unit":"{code}","roles":["qualityInformation"],"classification:classes":[{"value":0,"name":"missing","nodata":true},{"value":1,"name":"warming"},{"value":2,"name":"stale"},{"value":3,"name":"sensor-error"},{"value":4,"name":"valid"},{"value":5,"name":"model-mismatch"}],"opensensor:property":"urn:walkthru-earth:property:particle_sensor_status","opensensor:procedure":"pms5003t","opensensor:field_id":11,"opensensor:aggregate":"mode"},{"name":"pms_age_ms","type":"int64","unit":"ms","roles":["qualityInformation"],"opensensor:property":"urn:walkthru-earth:property:particle_sensor_frame_age","opensensor:procedure":"pms5003t","opensensor:field_id":12,"opensensor:valid_when":{"column":"pms_age_ms","finite":true},"opensensor:aggregate":"point"},{"name":"pm1_cf1_ug_m3","type":"int32","unit":"ug/m3","roles":["physicalMeasurement"],"opensensor:property":"urn:walkthru-earth:property:pm1_cf1_mass_concentration","opensensor:procedure":"pms5003t","opensensor:field_id":13,"opensensor:valid_when":{"column":"pms_status","equals":4},"opensensor:settle_s":180,"opensensor:aggregate":"mean","opensensor:plausible_range":[0,1000]},{"name":"pm25_cf1_ug_m3","type":"int32","unit":"ug/m3","roles":["physicalMeasurement"],"opensensor:property":"urn:walkthru-earth:property:pm25_cf1_mass_concentration","opensensor:procedure":"pms5003t","opensensor:field_id":14,"opensensor:valid_when":{"column":"pms_status","equals":4},"opensensor:settle_s":180,"opensensor:aggregate":"mean","opensensor:plausible_range":[0,1000]},{"name":"pm10_cf1_ug_m3","type":"int32","unit":"ug/m3","roles":["physicalMeasurement"],"opensensor:property":"urn:walkthru-earth:property:pm10_cf1_mass_concentration","opensensor:procedure":"pms5003t","opensensor:field_id":15,"opensensor:valid_when":{"column":"pms_status","equals":4},"opensensor:settle_s":180,"opensensor:aggregate":"mean","opensensor:plausible_range":[0,1000]},{"name":"pm1_atmospheric_ug_m3","type":"int32","unit":"ug/m3","roles":["physicalMeasurement"],"cf:standard_name":"mass_concentration_of_pm1_ambient_aerosol_particles_in_air","opensensor:property":"http://vocab.nerc.ac.uk/standard_name/mass_concentration_of_pm1_ambient_aerosol_particles_in_air/","opensensor:procedure":"pms5003t","opensensor:field_id":16,"opensensor:valid_when":{"column":"pms_status","equals":4},"opensensor:settle_s":180,"opensensor:aggregate":"mean","opensensor:plausible_range":[0,1000]},{"name":"pm25_atmospheric_ug_m3","type":"int32","unit":"ug/m3","roles":["physicalMeasurement"],"cf:standard_name":"mass_concentration_of_pm2p5_ambient_aerosol_particles_in_air","opensensor:property":"http://vocab.nerc.ac.uk/collection/P07/current/YUDG9DXK/","opensensor:procedure":"pms5003t","opensensor:field_id":17,"opensensor:valid_when":{"column":"pms_status","equals":4},"opensensor:settle_s":180,"opensensor:aggregate":"mean","opensensor:plausible_range":[0,1000]},{"name":"pm10_atmospheric_ug_m3","type":"int32","unit":"ug/m3","roles":["physicalMeasurement"],"cf:standard_name":"mass_concentration_of_pm10_ambient_aerosol_particles_in_air","opensensor:property":"http://vocab.nerc.ac.uk/standard_name/mass_concentration_of_pm10_ambient_aerosol_particles_in_air/","opensensor:procedure":"pms5003t","opensensor:field_id":18,"opensensor:valid_when":{"column":"pms_status","equals":4},"opensensor:settle_s":180,"opensensor:aggregate":"mean","opensensor:plausible_range":[0,1000]},{"name":"particles_gt03_per_01l","type":"int32","unit":"{particles}/dL","roles":["physicalMeasurement"],"opensensor:property":"urn:walkthru-earth:property:particle_count_gt_0p3um","opensensor:procedure":"pms5003t","opensensor:field_id":19,"opensensor:valid_when":{"column":"pms_status","equals":4},"opensensor:settle_s":180,"opensensor:aggregate":"mean","opensensor:plausible_range":[0,65535]},{"name":"particles_gt05_per_01l","type":"int32","unit":"{particles}/dL","roles":["physicalMeasurement"],"opensensor:property":"urn:walkthru-earth:property:particle_count_gt_0p5um","opensensor:procedure":"pms5003t","opensensor:field_id":20,"opensensor:valid_when":{"column":"pms_status","equals":4},"opensensor:settle_s":180,"opensensor:aggregate":"mean","opensensor:plausible_range":[0,65535]},{"name":"particles_gt10_per_01l","type":"int32","unit":"{particles}/dL","roles":["physicalMeasurement"],"opensensor:property":"urn:walkthru-earth:property:particle_count_gt_1um","opensensor:procedure":"pms5003t","opensensor:field_id":21,"opensensor:valid_when":{"column":"pms_status","equals":4},"opensensor:settle_s":180,"opensensor:aggregate":"mean","opensensor:plausible_range":[0,65535]},{"name":"particles_gt25_per_01l","type":"int32","unit":"{particles}/dL","roles":["physicalMeasurement"],"opensensor:property":"urn:walkthru-earth:property:particle_count_gt_2p5um","opensensor:procedure":"pms5003t","opensensor:field_id":22,"opensensor:valid_when":{"column":"pms_status","equals":4},"opensensor:settle_s":180,"opensensor:aggregate":"mean","opensensor:plausible_range":[0,65535]},{"name":"sensor_serial_code","type":"int64","unit":"1","roles":["referenceInformation"],"opensensor:property":"urn:walkthru-earth:property:particle_sensor_serial_code","opensensor:procedure":"owner_provisioned_identity","opensensor:field_id":23,"opensensor:valid_when":{"column":"sensor_serial_code","finite":true},"opensensor:aggregate":"mode"},{"name":"pm25_batch_candidate_ug_m3","type":"float","unit":"ug/m3","roles":["modelResult"],"opensensor:property":"urn:walkthru-earth:property:pm25_batch_candidate_mass_concentration","opensensor:procedure":"airgradient_20260408_count_candidate_v1","opensensor:field_id":24,"opensensor:valid_when":{"column":"pm25_batch_candidate_status","equals":3},"opensensor:settle_s":180,"opensensor:derived":{"from":["particles_gt03_per_01l"],"method":"urn:walkthru-earth:method:airgradient_20260408_count_candidate_v1"},"opensensor:aggregate":"mean","opensensor:plausible_range":[0,1000]},{"name":"pm25_batch_candidate_status","type":"int32","unit":"{code}","roles":["qualityInformation"],"classification:classes":[{"value":0,"name":"disabled"},{"value":1,"name":"identity-mismatch"},{"value":2,"name":"PMS-unavailable"},{"value":3,"name":"candidate-only"}],"opensensor:property":"urn:walkthru-earth:property:pm25_batch_candidate_status","opensensor:procedure":"batch_candidate_gate","opensensor:field_id":25,"opensensor:aggregate":"mode"},{"name":"ambient_temperature_c","type":"float","unit":"Cel","roles":["physicalMeasurement"],"cf:standard_name":"air_temperature","opensensor:property":"http://vocab.nerc.ac.uk/collection/P07/current/CFSN0023/","opensensor:procedure":"pms5003t","opensensor:field_id":26,"opensensor:valid_when":{"column":"ambient_temperature_c","finite":true},"opensensor:aggregate":"mean","opensensor:plausible_range":[-10,60]},{"name":"relative_humidity_percent","type":"float","unit":"%","roles":["physicalMeasurement"],"